{
  "actualCapacity": "example-value",
  "creationTime": "example-value",
  "description": "example-value",
  "engineType": "example-value",
  "engineVersion": "example-value",
  "environmentArn": "arn:aws:m2:us-east-1:123456789012:app/abc123",
  "environmentId": "abc12345",
  "highAvailabilityConfig": "example-value",
  "instanceType": "example-value",
  "kmsKeyId": "abc12345",
  "loadBalancerArn": "arn:aws:m2:us-east-1:123456789012:app/abc123",
  "name": "my-app",
  "pendingMaintenance": "example-value",
  "preferredMaintenanceWindow": "example-value",
  "publiclyAccessible": "example-value",
  "securityGroupIds": "abc12345",
  "status": "Running",
  "statusReason": "Running",
  "storageConfigurations": "example-value",
  "subnetIds": "abc12345",
  "tags": "example-value",
  "vpcId": "abc12345"
}